{
  "id": "tribe.light.v1",
  "tribe": "Light",
  "lensId": "lens.ui_composition",
  "color": "#FFE066",
  "icon": "assets/reinmaker/icons/tribe_light.png",
  "featuredQuoteKey": "reinmaker.tribes.light.quote",
  "ageDifficulty": {
    "2-5": { "difficulty": "spark", "hintCadence": "frequent" },
    "6-12": { "difficulty": "spark", "hintCadence": "frequent" },
    "13-17": { "difficulty": "craft", "hintCadence": "moderate" },
    "18-35": { "difficulty": "craft", "hintCadence": "moderate" },
    "36-60": { "difficulty": "craft", "hintCadence": "moderate" },
    "61-102": { "difficulty": "spark", "hintCadence": "frequent" }
  },
  "tiers": [
    {
      "tier": 1,
      "stoneId": "light.spark",
      "quests": ["q.light.001", "q.light.002"],
      "lessonRefs": ["leaves-change-color"]
    },
    {
      "tier": 2,
      "stoneId": "light.craft",
      "quests": ["q.light.101"],
      "lessonRefs": ["water-cycle"]
    },
    {
      "tier": 3,
      "stoneId": "light.mastery",
      "quests": ["q.light.201"],
      "lessonRefs": []
    }
  ],
  "finaleStoneId": "light.mastery"
}

















